{"$schema":"https://json-schema.org/draft/2020-12/schema","$id":"https://r8-kumamoto-saigai.local/schemas/reconstruction/source.schema.json","type":"array","items":{"type":"object","additionalProperties":false,"required":["id","organizationId","sourceType","title","url","publishedAt","revisedAt","retrievedAt","checkedAt","contentHash","archivedPath","officiality","status","notes"],"properties":{"id":{"type":"string","pattern":"^source_[a-z0-9_]+$"},"organizationId":{"type":"string"},"sourceType":{"$ref":"common.schema.json#/$defs/sourceType"},"title":{"type":"string","minLength":1},"url":{"type":"string","format":"uri"},"publishedAt":{"$ref":"common.schema.json#/$defs/nullableDateOrDateTime"},"revisedAt":{"$ref":"common.schema.json#/$defs/nullableDateOrDateTime"},"retrievedAt":{"$ref":"common.schema.json#/$defs/nullableDateOrDateTime"},"checkedAt":{"$ref":"common.schema.json#/$defs/nullableDateOrDateTime"},"contentHash":{"type":["string","null"]},"archivedPath":{"type":["string","null"]},"officiality":{"$ref":"common.schema.json#/$defs/officiality"},"status":{"$ref":"common.schema.json#/$defs/sourceStatus"},"notes":{"type":["string","null"]}}}}
