[
  {
    "id": "source_cabinet_notifications_r8_kumamoto_earthquake",
    "organizationId": "org_cabinet_office_disaster_management",
    "sourceType": "web_page",
    "title": "内閣府防災担当からの各都道府県等への通知等",
    "url": "https://www.bousai.go.jp/updates/r8kumamoto_jishin/tsuuchi.html",
    "publishedAt": null,
    "revisedAt": "2026-08-07",
    "retrievedAt": "2026-09-25T14:21:11+09:00",
    "checkedAt": "2026-09-25T14:21:11+09:00",
    "contentHash": "sha256:5785ced4d0c35fd2a7803ce6b850ea5782657b349428751beaa06b4868273435",
    "archivedPath": null,
    "officiality": "primary_official",
    "status": "active",
    "notes": "令和8年熊本地震に関する内閣府防災担当の通知一覧。2026年8月10日取得時点で6件を掲載し、8月3日付『被災者の住まいの確保に向けた留意事項について』を含む。通知への公式入口として登録し、一覧ページ単独では金額・対象条件等の確定根拠に使用しない。"
  },
  {
    "id": "source_cabinet_relief_act_application_r8_earthquake",
    "organizationId": "org_cabinet_office_disaster_management",
    "sourceType": "notice",
    "title": "令和8年熊本地震に係る災害救助法の適用について",
    "url": "https://www.bousai.go.jp/pdf/260728.pdf",
    "publishedAt": "2026-07-28",
    "revisedAt": null,
    "retrievedAt": "2026-08-09T18:03:00+09:00",
    "checkedAt": "2026-08-09T18:03:00+09:00",
    "contentHash": "sha256:423af3b018a703682b9f3c99f32115b2c6f31527360a4143c510f48b37f12b69",
    "archivedPath": null,
    "officiality": "primary_official",
    "status": "active",
    "notes": "全1ページをテキスト抽出・画像化して目視確認。宇土市を含む21市町村、法適用日7月28日を確認。"
  },
  {
    "id": "source_cabinet_disaster_relief_act_overview",
    "organizationId": "org_cabinet_office_disaster_management",
    "sourceType": "pdf",
    "title": "災害救助法の概要",
    "url": "https://www.bousai.go.jp/taisaku/hisaisyagyousei/pdf/saigaikyujo_gaiyou.pdf",
    "publishedAt": null,
    "revisedAt": null,
    "retrievedAt": "2026-08-09T18:03:00+09:00",
    "checkedAt": "2026-08-09T18:03:00+09:00",
    "contentHash": "sha256:bb55d29e512bc1855111f6b569cad15dc078b95e03fa6fe87f8c76c653314853",
    "archivedPath": null,
    "officiality": "primary_official",
    "status": "active",
    "notes": "全1ページをテキスト抽出・画像化して目視確認。救助の種類として住宅の応急修理を確認。"
  },
  {
    "id": "source_kumamoto_relief_act_application_r8_earthquake",
    "organizationId": "org_kumamoto_prefecture",
    "sourceType": "notice",
    "title": "令和8年熊本地震に係る災害救助法の適用について",
    "url": "https://www.pref.kumamoto.jp/soshiki/27/274494.html",
    "publishedAt": "2026-07-28",
    "revisedAt": "2026-07-28",
    "retrievedAt": "2026-08-09T18:03:00+09:00",
    "checkedAt": "2026-08-09T18:03:00+09:00",
    "contentHash": "sha256:a2ca22323d26d4122f830ec1fbb17cbd5eb1cd8097cc473b9bba7da9ab63d242",
    "archivedPath": null,
    "officiality": "primary_official",
    "status": "active",
    "notes": "適用日は令和8年7月28日。熊本市を含む21市町村を確認。"
  },
  {
    "id": "source_kumamoto_emergency_housing_repair_page",
    "organizationId": "org_kumamoto_prefecture",
    "sourceType": "web_page",
    "title": "【令和8年熊本地震】被災した住宅の応急修理について",
    "url": "https://www.pref.kumamoto.jp/soshiki/27/275109.html",
    "publishedAt": "2026-08-02",
    "revisedAt": "2026-08-02",
    "retrievedAt": "2026-09-12T01:54:55+09:00",
    "checkedAt": "2026-09-12T01:54:55+09:00",
    "contentHash": "sha256:c422d45ba38732eeeabed61f5f73ee5b2fd79b27313238ad8e448e13c2352ea7",
    "archivedPath": null,
    "officiality": "primary_official",
    "status": "active",
    "notes": "県実施20市町村の制度開始を確認。宇土市行は担当部署・受付開始日・連絡先・ホームページが確認中。"
  },
  {
    "id": "source_kumamoto_emergency_housing_repair_user_guide",
    "organizationId": "org_kumamoto_prefecture",
    "sourceType": "application_guide",
    "title": "令和8年熊本地震 被災した住宅の応急修理制度について（被災者の皆さまへ）",
    "url": "https://www.pref.kumamoto.jp/uploaded/attachment/316365.pdf",
    "publishedAt": null,
    "revisedAt": null,
    "retrievedAt": "2026-08-09T18:03:00+09:00",
    "checkedAt": "2026-08-09T18:03:00+09:00",
    "contentHash": "sha256:6f67a43ebea4569fbcdb019ab7aafdf41d39590fd84ce0683211210daacee9af",
    "archivedPath": null,
    "officiality": "primary_official",
    "status": "active",
    "notes": "全2ページを抽出・目視確認。既存の制度資料アーカイブ規約が未定義のため、重複保存せず公式URLとハッシュを保持。"
  },
  {
    "id": "source_kumamoto_emergency_housing_repair_guideline",
    "organizationId": "org_kumamoto_prefecture",
    "sourceType": "guideline",
    "title": "令和8年熊本地震に係る被災した住宅の応急修理実施要領",
    "url": "https://www.pref.kumamoto.jp/uploaded/attachment/315819.pdf",
    "publishedAt": null,
    "revisedAt": null,
    "retrievedAt": "2026-08-09T18:03:00+09:00",
    "checkedAt": "2026-08-09T18:03:00+09:00",
    "contentHash": "sha256:dbe513d6348d235809806005ca0b10bcdc79c2882f11184d9ccc0b025028fe7d",
    "archivedPath": null,
    "officiality": "primary_official",
    "status": "active",
    "notes": "令和8年7月28日適用、7月31日施行。全23ページ。既存の制度資料アーカイブ規約が未定義のため、公式URLとハッシュを保持。"
  },
  {
    "id": "source_uto_support_application_index_r8_earthquake",
    "organizationId": "org_uto_city",
    "sourceType": "web_page",
    "title": "支援・申請",
    "url": "https://www.city.uto.lg.jp/article/list/1307.html",
    "publishedAt": null,
    "revisedAt": null,
    "retrievedAt": "2026-10-14T21:21:38+09:00",
    "checkedAt": "2026-10-14T21:21:38+09:00",
    "contentHash": "sha256:92445d0974f8bc55b30ba8e57b96d4e0097e9115baba77ada02203923be47886",
    "archivedPath": null,
    "officiality": "primary_official",
    "status": "active",
    "notes": "2026年8月10日に再取得。8月7日付の『災害救助法に基づく被災住宅の応急修理制度について』と『すまいの相談窓口』を確認。個別記事を別sourceとして登録したが、人手レビュー前のためverifiedへ変更しない。『住家の緊急修理』とは別制度として扱う。"
  },
  {
    "id": "source_uto_emergency_housing_repair_page_r8_earthquake",
    "organizationId": "org_uto_city",
    "sourceType": "web_page",
    "title": "災害救助法に基づく被災住宅の応急修理制度について",
    "url": "https://www.city.uto.lg.jp/article/view/1243/16523.html",
    "publishedAt": "2026-08-07",
    "revisedAt": null,
    "retrievedAt": "2026-10-13T16:09:43+09:00",
    "checkedAt": "2026-10-13T16:09:43+09:00",
    "contentHash": "sha256:31f0dcd0f07185733d17254d432059e60a5839c19d48b11c8c31fda2e0420bbe",
    "archivedPath": null,
    "officiality": "primary_official",
    "status": "active",
    "notes": "宇土市の制度個別案内。対象、修理範囲、限度額、完了期限候補、注意事項、様式、問い合わせ先を含む。登録値との差分は人手レビュー対象であり、このsource登録だけでは確認済み・承認済みを意味しない。"
  },
  {
    "id": "source_uto_housing_consultation_desk_r8_earthquake",
    "organizationId": "org_uto_city",
    "sourceType": "web_page",
    "title": "令和8年熊本地震被害に関する「すまいの相談窓口」の開設について",
    "url": "https://www.city.uto.lg.jp/article/view/1307/16522.html",
    "publishedAt": "2026-08-07",
    "revisedAt": null,
    "retrievedAt": "2026-10-14T21:21:38+09:00",
    "checkedAt": "2026-10-14T21:21:38+09:00",
    "contentHash": "sha256:8dad0c179368353c6a7463c34de81d60b782024a9134716fc8142be0ddffff92",
    "archivedPath": null,
    "officiality": "primary_official",
    "status": "active",
    "notes": "住まいの再建に関する相談・申請受付の総合窓口案内。住宅の応急修理の申請窓口・相談窓口としての役割範囲は人手で原文照合する。"
  },
  {
    "id": "source_hikawa_support_programs_20260820",
    "organizationId": "org_hikawa_town",
    "sourceType": "application_guide",
    "title": "令和8年熊本地震で被災された方に対する支援制度について（氷川町）",
    "url": "https://www.town.hikawa.kumamoto.jp/kiji0036782/3_6782_8258_up_e0ciixhm.pdf",
    "publishedAt": "2026-08-20",
    "revisedAt": null,
    "retrievedAt": "2026-08-21",
    "checkedAt": "2026-08-21",
    "contentHash": "sha256:c01a88a89b5184260a589e6e0ed472017a8076b48a09d0dff9157adc29c7bb2f",
    "archivedPath": null,
    "officiality": "primary_official",
    "status": "active",
    "notes": "全4ページをテキスト抽出して確認。前半2ページは罹災・被災証明、手数料免除、住宅支援、貸付・支援金、災害ごみ、ボランティアを案内。後半2ページは8月20日時点の物資、保育、給水、入浴、洗濯、ごみ、車両、避難所、ペット、下水道の生活支援。本更新では既存マスタにある応急修理と被災者生活再建支援金の自治体別運用へ反映。"
  }
]
